{
  "id": "EXP-0008",
  "question": "Can cheap stateless workers execute most well-specified work while ambiguous decisions are kept in a smaller control plane?",
  "hypothesis": "Routing only low-uncertainty WORK with objective oracles and explicit success/evidence contracts to instant workers, while escalating ambiguity to control, will reduce reasoning cost without increasing repeated work or incorrect autonomous decisions.",
  "status": "running",
  "conditions": {
    "workerRequirements": [
      "low uncertainty",
      "objective oracle",
      "explicit success criterion",
      "explicit evidence plan",
      "no architecture decision",
      "no conflicting evidence",
      "fewer than three failed attempts"
    ],
    "controlTriggers": [
      "missing execution contract",
      "medium/high uncertainty",
      "partial/no oracle",
      "architecture decision",
      "conflicting evidence",
      "three failed attempts",
      "explicit worker escalation"
    ]
  },
  "metrics": [
    "worker_completion_rate",
    "worker_escalation_rate",
    "incorrect_worker_decisions",
    "human_clarifications",
    "reasoning_cost_per_accepted_work",
    "duplicate_work_count"
  ],
  "evidence": [],
  "decision": null
}
