{
  "id": "EXP-0007",
  "question": "Can an existing repository adopt causal Git memory and durable agent work state without changing its language, package manager or legacy history?",
  "hypothesis": "One idempotent init command plus a reusable CI workflow can establish causal history, durable WORK refs and integration-boundary rules while exempting only the bootstrap commit.",
  "status": "accepted",
  "conditions": {
    "target": "arbitrary existing Git repository",
    "dependencyMode": "npx-from-github",
    "ciMode": "reusable-workflow",
    "workState": "refs/usegit/work/*"
  },
  "metrics": [
    "files_touched_by_init",
    "idempotent_reinit",
    "legacy_history_rewrites_required",
    "post_bootstrap_metadata_coverage",
    "target_stack_changes_required",
    "durable_work_protocol_present"
  ],
  "evidence": [
    {
      "source": "self-hosted-unit-tests",
      "commit": "0ffc5c526dac58cd06f450161231c836cc247ebb",
      "idempotentReinit": true,
      "existingAgentInstructionsPreserved": true,
      "bootstrapOnlyExemption": true
    },
    {
      "source": "github-actions-reusable-workflow",
      "runId": 35696062982,
      "fixtureBranch": "bench/bootstrap-adoption-v1",
      "bootstrapCommit": "d0fa4e68fa6d4563bcb4f59b22fb3a29a3f039e4",
      "bootstrapCommitHasCausalTrailers": false,
      "validation": "success",
      "report": "success",
      "gitNoteMaterialized": true,
      "filesTouchedByBootstrap": 6,
      "legacyHistoryRewritesRequired": 0,
      "targetStackChangesRequired": 0
    }
  ],
  "decision": {
    "outcome": "accepted",
    "reason": "The init path is idempotent in an isolated Git repository and a separate legacy-style fixture branch completed the reusable workflow end-to-end from an unstructured bootstrap commit. CI validated the bootstrap boundary, generated the causal report, and attached success evidence in refs/notes/usegit without rewriting legacy history or changing the target stack."
  }
}
