{
  "id": "EXP-0006",
  "question": "Can an AI invocation stop at an external wait and another invocation safely continue from Git alone?",
  "hypothesis": "Durable WORK refs with leases and explicit await continuations let a fresh agent resume correctly without chat history, while compare-and-swap ref updates prevent silent concurrent state loss.",
  "status": "running",
  "conditions": {
    "stateNamespace": "refs/usegit/work/*",
    "ownership": "expiring lease",
    "suspension": "await releases lease",
    "persistence": "state commit containing work.json"
  },
  "metrics": [
    "resume_success_rate",
    "tokens_to_first_correct_action",
    "stale_takeover_success_rate",
    "lost_update_count",
    "human_clarifications"
  ],
  "evidence": [
    {
      "kind": "blind-handoff",
      "work": "WORK-BLIND-0001",
      "awaitedEvent": "github-actions:run-35695189535",
      "observation": "Fresh invocation recovered the awaiting WORK ref from Git, independently verified the referenced workflow run concluded success, and selected the encoded success continuation without prior chat context.",
      "continuation": "add declarative WORK scopes and compact overlap/conflict reporting",
      "observedAt": "2026-09-22T06:39:00Z"
    }
  ],
  "decision": null
}
