{
  "id": "EXP-0009",
  "question": "Can one control decision safely fan out into many self-service worker tasks without manual assignment or scope collisions?",
  "hypothesis": "A batch plan plus a deterministic scope-safe worker queue and atomic claim-next will let many stateless workers self-schedule while preventing duplicate claims and concurrent overlap.",
  "status": "running",
  "conditions": {
    "batch": "control creates up to 100 durable WORK items from one plan",
    "dispatch": "only an independent set of scope-compatible ready work is visible",
    "claim": "workers atomically claim the first dispatchable WORK and retry after ref races",
    "dependencies": "dependent WORK stays blocked until predecessors are accepted"
  },
  "metrics": [
    "batch_creation_latency",
    "manual_worker_assignments",
    "duplicate_claim_count",
    "concurrent_scope_collision_count",
    "queue_blocked_count",
    "accepted_work_per_control_intervention"
  ],
  "evidence": [],
  "decision": null
}
